<?xml version="1.0" encoding="UTF-8"?>
<!--~
  ~   Licensed to the Apache Software Foundation (ASF) under one
  ~   or more contributor license agreements.  See the NOTICE file
  ~   distributed with this work for additional information
  ~   regarding copyright ownership.  The ASF licenses this file
  ~   to you under the Apache License, Version 2.0 (the
  ~   "License"); you may not use this file except in compliance
  ~   with the License.  You may obtain a copy of the License at
  ~
  ~       http://www.apache.org/licenses/LICENSE-2.0
  ~
  ~   Unless required by applicable law or agreed to in writing, software
  ~   distributed under the License is distributed on an "AS IS" BASIS,
  ~   WITHOUT WARRANTIES OR CONDITIONS OF ANY KIND, either express or implied.
  ~   See the License for the specific language governing permissions and
  ~   limitations under the License.
  -->

<!DOCTYPE schema SYSTEM "solrres://tisrepository/dtd/solrschema.dtd">
<schema name="template" version="1.5">
  <types>
    <fieldType name="string" class="solr.StrField" sortMissingLast="true" omitNorms="true" omitTermFreqAndPositions="true" />
    <fieldType name="int" class="solr.IntPointField" docValues="false" />
    <fieldType name="float" class="solr.FloatPointField" docValues="false" />
    <fieldType name="long" class="solr.LongPointField" docValues="false" />
    <fieldType name="double" class="solr.DoublePointField" docValues="false" />
    <fieldType name="date" class="com.qlangtech.tis.solrextend.fieldtype.TisDateField" docValues="false" />
    <fieldType name="timestamp" class="com.qlangtech.tis.solrextend.fieldtype.TisTimestampField" docValues="false" />
    <fieldType name="bitwise" class="com.qlangtech.tis.solrextend.fieldtype.BitwiseField" omitNorms="true" omitTermFreqAndPositions="true" />
    <fieldType name="ik" class="solr.TextField" autoGeneratePhraseQueries="false" omitNorms="true" omitTermFreqAndPositions="false">
      <analyzer type="query">
        <tokenizer class="com.qlangtech.tis.solrextend.fieldtype.st.STConvertTokenizerFactory" />
        <filter class="com.qlangtech.tis.solrextend.analyzer.IKTokenFilterFactory" />
        <filter class="solr.LowerCaseFilterFactory" />
        <filter class="solr.TrimFilterFactory" />
      </analyzer>
      <analyzer type="index">
        <tokenizer class="com.qlangtech.tis.solrextend.fieldtype.st.STConvertTokenizerFactory" />
        <filter class="com.qlangtech.tis.solrextend.analyzer.IKTokenFilterFactory" />
      </analyzer>
    </fieldType>
    <fieldType name="text_ws" class="solr.TextField" sortMissingLast="true" omitNorms="true" autoGeneratePhraseQueries="false" omitTermFreqAndPositions="true">
      <analyzer>
        <tokenizer class="solr.WhitespaceTokenizerFactory" />
      </analyzer>
    </fieldType>
    <fieldType name="like" class="solr.TextField" sortMissingLast="true" omitNorms="true" autoGeneratePhraseQueries="false" omitTermFreqAndPositions="true">
      <analyzer type="index">
        <tokenizer class="solr.NGramTokenizerFactory" minGramSize="2" maxGramSize="7" />
        <filter class="solr.LowerCaseFilterFactory" />
      </analyzer>
      <analyzer type="query">
        <tokenizer class="solr.WhitespaceTokenizerFactory" />
        <filter class="solr.LowerCaseFilterFactory" />
      </analyzer>
    </fieldType>
    <fieldType name="pinyin" class="solr.TextField" positionIncrementGap="100" autoGeneratePhraseQueries="false" omitNorms="true" omitPositions="true">
      <analyzer type="index">
        <tokenizer class="solr.PatternTokenizerFactory" pattern=",\s*" />
        <filter class="solr.NGramFilterFactory" minGramSize="1" maxGramSize="7" />
        <filter class="solr.LowerCaseFilterFactory" />
        <filter class="solr.TrimFilterFactory" />
        <filter class="com.qlangtech.tis.solrextend.fieldtype.pinyin.PinyinTokenFilterFactory" />
      </analyzer>
      <analyzer type="query">
        <tokenizer class="solr.PatternTokenizerFactory" pattern=",\s*" />
        <filter class="solr.LowerCaseFilterFactory" />
      </analyzer>
    </fieldType>
    <fieldType name="test" class="plugin:test" positionIncrementGap="0" />
  </types>
  <fields>
    <field name="emp_no" type="string" stored="true" indexed="true" docValues="true" multiValued="false" />
    <field name="birth_date" type="date" stored="true" indexed="false" docValues="true" multiValued="false" />
    <field name="first_name" type="test" stored="true" indexed="false" docValues="true" multiValued="false" />
    <field name="last_name" type="string" stored="true" indexed="false" docValues="true" multiValued="false" />
    <field name="gender" type="string" stored="true" indexed="false" docValues="true" multiValued="false" />
    <field name="hire_date" type="timestamp" stored="true" indexed="false" docValues="true" multiValued="false" />
    <field name="_version_" type="long" stored="true" indexed="false" docValues="true" multiValued="false" />
    <field name="text" type="string" stored="false" indexed="true" docValues="false" multiValued="true" />
    <dynamicField name="json_*" type="string" stored="true" indexed="true" docValues="true" multiValued="false" />
  </fields>
  <uniqueKey>emp_no</uniqueKey>
  <sharedKey>emp_no</sharedKey>
</schema>
