<?xml version="1.0" encoding="UTF-8"?>
<!--~
  ~   Licensed to the Apache Software Foundation (ASF) under one
  ~   or more contributor license agreements.  See the NOTICE file
  ~   distributed with this work for additional information
  ~   regarding copyright ownership.  The ASF licenses this file
  ~   to you under the Apache License, Version 2.0 (the
  ~   "License"); you may not use this file except in compliance
  ~   with the License.  You may obtain a copy of the License at
  ~
  ~       http://www.apache.org/licenses/LICENSE-2.0
  ~
  ~   Unless required by applicable law or agreed to in writing, software
  ~   distributed under the License is distributed on an "AS IS" BASIS,
  ~   WITHOUT WARRANTIES OR CONDITIONS OF ANY KIND, either express or implied.
  ~   See the License for the specific language governing permissions and
  ~   limitations under the License.
  -->

<!DOCTYPE schema SYSTEM    "solrres://tisrepository/dtd/solrschema.dtd">
<schema name="search4dfireOrderInfo" version="1.5">
    <types>
        <fieldType name="string" class="solr.StrField" sortMissingLast="true" omitNorms="true"
                   omitTermFreqAndPositions="true"/>
        <fieldType name="test" class="plugin:test" precisionStep="0" positionIncrementGap="0" sortMissingLast="true"/>
    </types>
    <fields>

        <field name="totalpay_id" type="string" stored="true" indexed="true" required="true" docValues="true"/>
        <field name="curr_date" type="test" stored="true" indexed="true" docValues="true" required="false"/>
    </fields>
    <sharedKey>entity_id</sharedKey>
    <uniqueKey>totalpay_id</uniqueKey>
</schema>
